{"schemaVersion":1,"publisherProfileReference":"AvivPeretsFBX","product":{"displayName":"Modular Armour","assetId":"ModularArmour","folderName":"Modular_Armour","case":"item-set","version":"1.2.0"},"targets":["portable","unity"],"sourceAssets":[{"kind":"fbx","logicalReference":"models/helmet.fbx"},{"kind":"image","logicalReference":"textures/shared-armour.png"}],"materials":[],"animations":[],"itemSet":{"items":[{"id":"Helmet","categories":["armour"],"attachmentSlot":"head","sharedAssetReferences":["SharedArmour"]},{"id":"Shoulders","categories":["armour"],"attachmentSlot":"shoulders","sharedAssetReferences":["SharedArmour"]}],"relationships":[{"firstItemId":"Helmet","secondItemId":"Shoulders"}],"sharedAssets":[{"id":"SharedArmour","source":{"kind":"image","logicalReference":"textures/shared-armour.png"}}],"assembledSetRules":{"members":[{"itemId":"Helmet","attachmentSlot":"head"},{"itemId":"Shoulders","attachmentSlot":"shoulders"}],"requireUniqueAttachmentSlots":true,"compatibilityMetadata":[{"key":"Generation","value":"One"}]}}}
