{"schemaVersion":1,"publisherProfileReference":"AvivPeretsFBX","product":{"displayName":"Stone Arch","assetId":"StoneArch","folderName":"Stone_Arch","case":"static","version":"1.0.0"},"targets":["portable"],"sourceAssets":[{"kind":"fbx","logicalReference":"source/StoneArch.fbx","originalFileName":"StoneArch.fbx"}],"materials":[{"id":"StoneArchMaterial","metallicFactor":0,"roughnessFactor":0.8,"normalScale":1,"emission":{"red":0,"green":0,"blue":0,"intensity":0},"ambientOcclusionStrength":1,"heightScale":0,"opacity":1,"surfaceMode":"opaque","uvTransform":{"scaleU":1,"scaleV":1,"offsetU":0,"offsetV":0},"doubleSided":false,"textureAssignments":[]}],"animations":[],"marketplaceProfileReference":{"marketplace":"fab","profile":"default"}}

