{"schemaVersion":1,"publisherProfileReference":"AvivPeretsFBX","product":{"displayName":"Rigged Robot","assetId":"RiggedRobot","folderName":"Rigged_Robot","case":"rigged","version":"2.1.0"},"targets":["portable","unity"],"sourceAssets":[{"kind":"fbx","logicalReference":"models/robot.fbx"}],"materials":[],"rig":{"type":"generic","bones":[{"identity":"Root"}],"referencePose":[{"boneIdentity":"Root","transform":{"translationX":0,"translationY":0,"translationZ":0,"rotationX":0,"rotationY":0,"rotationZ":0,"rotationW":1,"scaleX":1,"scaleY":1,"scaleZ":1}}]},"animations":[]}
