{"schemaVersion":1,"publisherProfileReference":"ExamplePublisher","product":{"displayName":"Example Set","assetId":"ExampleSet","folderName":"ExampleSet","case":"item-set","version":"1.0.0"},"targets":["unity"],"sourceAssets":[{"kind":"fbx","logicalReference":"models/zed.fbx"},{"kind":"fbx","logicalReference":"models/alpha-a.fbx"},{"kind":"fbx","logicalReference":"models/alpha-b.fbx"}],"materials":[],"animations":[],"itemSet":{"items":[{"id":"Zed","categories":[],"attachmentSlot":"head","sharedAssetReferences":[]},{"id":"Alpha","categories":[],"attachmentSlot":"body","sharedAssetReferences":[]}],"relationships":[],"sharedAssets":[],"assembledSetRules":{"members":[{"itemId":"Alpha","attachmentSlot":"body"},{"itemId":"Zed","attachmentSlot":"head"}],"requireUniqueAttachmentSlots":true,"compatibilityMetadata":[{"key":"Generation","value":"One"}]}},"itemSourceAssignments":[{"itemId":"Zed","sourceReference":"models/zed.fbx"},{"itemId":"Alpha","sourceReference":"models/alpha-a.fbx"},{"itemId":"Alpha","sourceReference":"models/alpha-b.fbx"}]}
