{"schemaVersion":1,"publisherProfileReference":"AvivPeretsFBX","product":{"displayName":"Prop Collection","assetId":"PropCollection","folderName":"Prop_Collection","case":"item-collection","version":"3.0.0"},"targets":["portable"],"sourceAssets":[{"kind":"glb","logicalReference":"models/crate.glb"}],"materials":[],"animations":[],"itemCollection":{"items":[{"id":"Crate","categories":["prop"],"sharedAssetReferences":[]}],"relationships":[],"sharedAssets":[]}}
