{"schemaVersion":1,"publisherProfileReference":"AvivPeretsFBX","product":{"displayName":"Stone Arch","assetId":"StoneArch","folderName":"Stone_Arch","case":"static","version":"1.0.0"},"targets":["portable","unity","unreal"],"sourceAssets":[{"kind":"fbx","logicalReference":"models/stone-arch.fbx","originalFileName":"stone-arch.fbx"},{"kind":"image","logicalReference":"textures/stone-albedo.png","originalFileName":"stone-albedo.png"},{"kind":"image","logicalReference":"textures/stone-normal.png","originalFileName":"stone-normal.png"}],"materials":[{"id":"StoneMaterial","metallicFactor":0,"roughnessFactor":0.8,"normalScale":1,"emission":{"red":0,"green":0,"blue":0,"intensity":0},"ambientOcclusionStrength":1,"heightScale":0,"opacity":1,"surfaceMode":"cutout","alphaCutoff":0.5,"uvTransform":{"scaleU":1,"scaleV":1,"offsetU":0,"offsetV":0},"doubleSided":false,"textureAssignments":[{"source":{"kind":"image","logicalReference":"textures/stone-albedo.png","originalFileName":"stone-albedo.png"},"role":"albedo","colourSpace":"srgb"},{"source":{"kind":"image","logicalReference":"textures/stone-normal.png","originalFileName":"stone-normal.png"},"role":"normal","colourSpace":"linear","normalConvention":"open-gl"}]}],"animations":[],"marketplaceProfileReference":{"marketplace":"fab","profile":"default"}}
