{"schemaVersion":1,"publisherProfileReference":"AvivPeretsFBX","product":{"displayName":"Animated Robot","assetId":"AnimatedRobot","folderName":"Animated_Robot","case":"rigged-animated","version":"2.1.1"},"targets":["portable","unreal"],"sourceAssets":[{"kind":"fbx","logicalReference":"models/animated-robot.fbx"}],"materials":[],"rig":{"type":"generic","bones":[{"identity":"Root"},{"identity":"Spine","parentIdentity":"Root"}],"referencePose":[{"boneIdentity":"Root","transform":{"translationX":0,"translationY":0,"translationZ":0,"rotationX":0,"rotationY":0,"rotationZ":0,"rotationW":1,"scaleX":1,"scaleY":1,"scaleZ":1}},{"boneIdentity":"Spine","transform":{"translationX":0,"translationY":1,"translationZ":0,"rotationX":0,"rotationY":0,"rotationZ":0,"rotationW":1,"scaleX":1,"scaleY":1,"scaleZ":1}}]},"animations":[{"name":"Walk","startFrame":0,"endFrame":30,"framesPerSecond":30,"loopBehavior":"loop","rootMotionStatus":"root-bone","rootMotionBoneIdentity":"Root"}]}
